{
  "$schema": "../schemas/pipeline-contract.schema.json",
  "id": "p8-martin-week",
  "version": 1,
  "status": "draft",
  "owner": "henry",
  "purpose": "LATER (needs the observer lane): turn Martin's week (what he built, how he prompts AI, what worked and what did not) into context for Wednesday's presentation.",
  "dictation_refs": [
    "#part3 observer lane"
  ],
  "trigger": {
    "cron": "0 9 * * 2",
    "timezone": "Asia/Bangkok"
  },
  "inputs": [
    {
      "source": "local:observer",
      "what": "Martin's week digest (not available yet)"
    }
  ],
  "steps": [
    {
      "id": "digest",
      "do": "Pick 1–3 stories from Martin's week for the deck",
      "lead": "editorial-lead"
    }
  ],
  "outputs": [
    "candidate items for P4"
  ],
  "done_when": [
    "items handed to P4 by Tuesday 12:00"
  ],
  "approvals": {
    "outward": "free"
  },
  "escalation": [
    {
      "to": "martin",
      "when": "a story touches private or client work",
      "via": "inbox_ask"
    }
  ],
  "metrics": [
    "stories_offered",
    "stories_used"
  ],
  "taskboard": {
    "project": "Henry",
    "issue_title": "P8 week {week}"
  }
}
